articles.I-N,J_Cell_Biol,J_Cell_Biol_1997_Apr_7_137(1)_193-202.nxml,Centrosomes Isolated from Spisula solidissima Oocytes Contain Rings and an Unusual Stoichiometric Ratio of / Tubulin,the journal of cell biology,JFRA-314,91,Centrosomes Isolated from Spisula solidissima Oocytes Contain Rings and an Unusual Stoichiometric Ratio of / Tubulin
articles.I-N,J_Cell_Biol,J_Cell_Biol_1999_Jun_14_145(6)_1233-1250.nxml,A Cytoplasmic Dynein Heavy Chain Is Required for Oscillatory Nuclear Movement of Meiotic Prophase and Efficient Meiotic Recombination in Fission Yeast,the journal of cell biology,PF-4035,172,A Cytoplasmic Dynein Heavy Chain Is Required for Oscillatory Nuclear Movement of Meiotic Prophase and Efficient Meiotic Recombination in Fission Yeast
articles.I-N,J_Cell_Biol,J_Cell_Biol_2010_Nov_29_191(5)_943-952.nxml,Drosophila Boi limits Hedgehog levels to suppress follicle stem cell proliferation Boi suppresses FSC proliferation,the journal of cell biology,IRG-92-027-16,23,Drosophila Boi limits Hedgehog levels to suppress follicle stem cell proliferation Boi suppresses FSC proliferation
articles.I-N,J_Cell_Biol,J_Cell_Biol_2009_Aug_24_186(4)_525-540.nxml,The BCL-2like protein CED-9 of C. elegans promotes FZO-1/Mfn1 2 and EAT-3/Opa1dependent mitochondrial fusion,the journal of cell biology,RSG-06-110-1-CCG,35,The BCL-2like protein CED-9 of C. elegans promotes FZO-1/Mfn1 2 and EAT-3/Opa1dependent mitochondrial fusion
articles.I-N,J_Cell_Biol,J_Cell_Biol_2006_Jan_16_172(2)_211-219.nxml,The Png1Rad23 complex regulates glycoprotein turnover,the journal of cell biology,RSG-05-158-01-TBE,86,The Png1–Rad23 complex regulates glycoprotein turnover
articles.I-N,J_Cell_Biol,J_Cell_Biol_2000_Dec_25_151(7)_1469-1482.nxml,Metaphase to Anaphase ( mat ) TransitionDefective Mutants in Caenorhabditis elegans,the journal of cell biology,PF-4444,118,Metaphase to Anaphase ( mat ) TransitionDefective Mutants in Caenorhabditis elegans
articles.I-N,J_Cell_Biol,J_Cell_Biol_2001_Jul_9_154(1)_95-108.nxml,The Toxoplasma gondii protein ROP2 mediates host organelle association with the parasitophorous vacuole membrane,the journal of cell biology,IRG 85-001-13-IRG,183,The Toxoplasma gondii protein ROP2 mediates host organelle association with the parasitophorous vacuole membrane
articles.I-N,J_Cell_Biol,J_Cell_Biol_2001_Nov_12_155(4)_581-592.nxml,Yeast Cdc42 functions at a late step in exocytosis  specifically during polarized growth of the emerging bud,the journal of cell biology,RPG-98-046-CCG,125,Yeast Cdc42 functions at a late step in exocytosis  specifically during polarized growth of the emerging bud
articles.I-N,J_Cell_Biol,J_Cell_Biol_2006_Apr_24_173(2)_207-218.nxml,Stepwise RNP assembly at the site of H/ACA RNA transcription in human cells,the journal of cell biology,RSG-01-050-01-GMC,103,Stepwise RNP assembly at the site of H/ACA RNA transcription in human cells
articles.I-N,J_Cell_Biol,J_Cell_Biol_2000_Jan_24_148(2)_385-397.nxml,ErbB2 Is Necessary for Induction of Carcinoma Cell Invasion by Erbb Family Receptor Tyrosine Kinases,the journal of cell biology,RPG-99-180-0,187,ErbB2 Is Necessary for Induction of Carcinoma Cell Invasion by Erbb Family Receptor Tyrosine Kinases
articles.I-N,J_Cell_Biol,J_Cell_Biol_2002_May_28_157(5)_873-882.nxml,Dual functions of 41 integrin in epicardial development initial migration and long-term attachment,the journal of cell biology,RPG-98-229-01-DDC,112,Dual functions of α4β1 integrin in epicardial development initial migration and long-term attachment
articles.I-N,J_Cell_Biol,J_Cell_Biol_1999_Aug_23_146(4)_709-722.nxml,Mcm2  but Not Rpa  Is a Component of the Mammalian Early G1-Phase Prereplication Complex,the journal of cell biology,RPG-98-076-01-GMC,156,Mcm2  but Not Rpa  Is a Component of the Mammalian Early G1-Phase Prereplication Complex
articles.I-N,J_Cell_Biol,J_Cell_Biol_2004_Sep_27_166(7)_1015-1025.nxml,Detection of snRNP assembly intermediates in Cajal bodies by fluorescence resonance energy transfer,the journal of cell biology,RPG-00-110-01-MGO,73,Detection of snRNP assembly intermediates in Cajal bodies by fluorescence resonance energy transfer
articles.I-N,J_Cell_Biol,J_Cell_Biol_2000_Oct_16_151(2)_367-380.nxml,Dnm1p Gtpase-Mediated Mitochondrial Fission Is a Multi-Step Process Requiring the Novel Integral Membrane Component Fis1p,the journal of cell biology,CB-97,444,Dnm1p Gtpase-Mediated Mitochondrial Fission Is a Multi-Step Process Requiring the Novel Integral Membrane Component Fis1p
articles.I-N,J_Cell_Biol,J_Cell_Biol_2013_Apr_1_201(1)_49-63.nxml,SCF Slimb ubiquitin ligase presses condensin IImediated nuclear reorganization by degrading Cap-H2 SCF Slimb presses condensin II activity,the journal of cell biology,RSG-07-040-01,6,SCF Slimb ubiquitin ligase presses condensin II–mediated nuclear reorganization by degrading Cap-H2 SCF Slimb presses condensin II activity
articles.I-N,J_Cell_Biol,J_Cell_Biol_2013_Jun_24_201(7)_997-1012.nxml,The tumor suppressor CDKN3 controls mitosis CDKN3 regulates mitosis,the journal of cell biology,IRG-84-002-28,4,The tumor suppressor CDKN3 controls mitosis CDKN3 regulates mitosis
articles.I-N,J_Cell_Biol,J_Cell_Biol_2003_Nov_10_163(3)_535-545.nxml,Cellular levels of p120 catenin function as a set point for cadherin expression levels in microvascular endothelial cells,the journal of cell biology,RPG CSM-100348,305,Cellular levels of p120 catenin function as a set point for cadherin expression levels in microvascular endothelial cells
articles.I-N,J_Cell_Biol,J_Cell_Biol_2008_Dec_1_183(5)_761-768.nxml,The Mad2 partial unfolding model: regulating mitosis through Mad2 conformational switching,the journal of cell biology,IRG-78-002-30,14,The Mad2 partial unfolding model: regulating mitosis through Mad2 conformational switching
articles.I-N,J_Cell_Biol,J_Cell_Biol_2005_Aug_15_170(4)_595-605.nxml,Transcytosis of NgCAM in epithelial cells reflects differential signal recognition on the endocytic and secretory pathways,the journal of cell biology,PF-01-092-01-CSM,39,Transcytosis of NgCAM in epithelial cells reflects differential signal recognition on the endocytic and secretory pathways
articles.I-N,J_Cell_Biol,J_Cell_Biol_1998_Nov_16_143(4)_1029-1040.nxml,Saccharomyces cerevisiae Duo1p and Dam1p  Novel Proteins Involved in Mitotic Spindle Function,the journal of cell biology,CB-106,81,Saccharomyces cerevisiae Duo1p and Dam1p  Novel Proteins Involved in Mitotic Spindle Function
articles.I-N,J_Cell_Biol,J_Cell_Biol_2003_Dec_8_163(5)_949-961.nxml,Chromosome instability in colorectal tumor cells is associated with defects in microtubule plus-end attachments caused by a dominant mutation in APC,the journal of cell biology,IRG-95-125-04,158,Chromosome instability in colorectal tumor cells is associated with defects in microtubule plus-end attachments caused by a dominant mutation in APC
articles.I-N,J_Cell_Biol,J_Cell_Biol_2000_Jul_10_150(1)_65-76.nxml,The Heat Shock Protein Ssa2p Is Required for Import of Fructose-1 6-Bisphosphatase into Vid Vesicles,the journal of cell biology,RPG-94-023-05,62,The Heat Shock Protein Ssa2p Is Required for Import of Fructose-1 6-Bisphosphatase into Vid Vesicles
articles.I-N,J_Cell_Biol,J_Cell_Biol_2005_Dec_5_171(5)_773-784.nxml,A novel role for the CBF3 kinetochorescaffold complex in regulating septin dynamics and cytokinesis,the journal of cell biology,RSG-02-035-01-CCG,22,A novel role for the CBF3 kinetochore–scaffold complex in regulating septin dynamics and cytokinesis
articles.I-N,J_Cell_Biol,J_Cell_Biol_1999_Sep_6_146(5)_1019-1032.nxml,The Role of Actin in Spindle Orientation Changes during the Saccharomyces cerevisiae Cell Cycle,the journal of cell biology,RPG-98-046-01-CCG,80,The Role of Actin in Spindle Orientation Changes during the Saccharomyces cerevisiae Cell Cycle
articles.I-N,J_Cell_Biol,J_Cell_Biol_2008_Mar_10_180(5)_957-971.nxml,Calpain 2 and PTP1B function in a novel pathway with Src to regulate invadopodia dynamics and breast cancer cell invasion,the journal of cell biology,RSG-03-245-01-CSM,89,Calpain 2 and PTP1B function in a novel pathway with Src to regulate invadopodia dynamics and breast cancer cell invasion
articles.I-N,J_Cell_Biol,J_Cell_Biol_2001_Jan_22_152(2)_11-16.nxml,Nuclear Position Leaves Its Mark on Replication Timing,the journal of cell biology,RPG-97-098-04-CCG,57,Nuclear Position Leaves Its Mark on Replication Timing
articles.I-N,J_Cell_Biol,J_Cell_Biol_2001_Jan_8_152(1)_97-110.nxml,Targeting Pyk2 to 1-IntegrinContaining Focal Contacts Rescues Fibronectin-Stimulated Signaling and Haptotactic Motility Defects of Focal Adhesion KinaseNull Cells,the journal of cell biology,RPG-98-109-01-TBE,76,Targeting Pyk2 to β1-Integrin–Containing Focal Contacts Rescues Fibronectin-Stimulated Signaling and Haptotactic Motility Defects of Focal Adhesion Kinase–Null Cells
articles.I-N,J_Cell_Biol,J_Cell_Biol_2000_Feb_21_148(4)_779-790.nxml,Exogenous Expression of N-Cadherin in Breast Cancer Cells Induces Cell Migration  Invasion  and Metastasis,the journal of cell biology,CA-98-267,656,Exogenous Expression of N-Cadherin in Breast Cancer Cells Induces Cell Migration  Invasion  and Metastasis
articles.I-N,J_Cell_Biol,J_Cell_Biol_1999_Oct_18_147(2)_321-334.nxml,Dynactin Is Required for Microtubule Anchoring at Centrosomes,the journal of cell biology,RPG-95-010-04-CSM,262,Dynactin Is Required for Microtubule Anchoring at Centrosomes
articles.I-N,J_Cell_Biol,J_Cell_Biol_2009_Jul_13_186(1)_57-73.nxml,The Drosophila afadin homologue Canoe regulates linkage of the actin cytoskeleton to adherens junctions during apical constriction,the journal of cell biology,RPG-00-237-01-CSM,73,The Drosophila afadin homologue Canoe regulates linkage of the actin cytoskeleton to adherens junctions during apical constriction
articles.I-N,J_Cell_Biol,J_Cell_Biol_2009_Jul_27_186(2)_269-282.nxml,Membrane proteins follow multiple pathways to the basolateral cell surface in polarized epithelial cells,the journal of cell biology,PF-06-243-01-CSM,51,Membrane proteins follow multiple pathways to the basolateral cell surface in polarized epithelial cells
articles.I-N,J_Cell_Biol,J_Cell_Biol_2007_Aug_27_178(5)_757-764.nxml,Regulation of the mitochondrial dynamin-like protein Opa1 by proteolytic cleavage,the journal of cell biology,RSG-01-147-01-CSM,205,Regulation of the mitochondrial dynamin-like protein Opa1 by proteolytic cleavage
articles.I-N,J_Cell_Biol,J_Cell_Biol_1998_Jan_12_140(1)_91-99.nxml,A Single Point Mutation Controls the Cholesterol Dependence of Semliki Forest Virus Entry and Exit,the journal of cell biology,RPG-93-013-05,111,A Single Point Mutation Controls the Cholesterol Dependence of Semliki Forest Virus Entry and Exit
articles.I-N,J_Cell_Biol,J_Cell_Biol_2013_Nov_11_203(3)_505-520.nxml,The midbody ring scaffolds the abscission machinery in the absence of midbody microtubules Scaffolding of abscission by the midbody ring,the journal of cell biology,PF-06-254-01-CCG,2,The midbody ring scaffolds the abscission machinery in the absence of midbody microtubules Scaffolding of abscission by the midbody ring
articles.I-N,J_Cell_Biol,J_Cell_Biol_1998_Mar_9_140(5)_1023-1037.nxml,A Dominant-negative Clathrin Mutant Differentially Affects Trafficking of Molecules with Distinct Sorting Motifs in the Class II Major Histocompatibility Complex (MHC) Pathway,the journal of cell biology,RPG-97-003-01-BE,114,A Dominant-negative Clathrin Mutant Differentially Affects Trafficking of Molecules with Distinct Sorting Motifs in the Class II Major Histocompatibility Complex (MHC) Pathway
articles.I-N,J_Cell_Biol,J_Cell_Biol_2010_Mar_8_188(5)_735-749.nxml,Integration of contractile forces during tissue invagination Integrating actomyosin contractility in tissues,the journal of cell biology,PF-06-143-01-DDC,130,Integration of contractile forces during tissue invagination Integrating actomyosin contractility in tissues
articles.I-N,J_Cell_Biol,J_Cell_Biol_2000_Jul_10_150(1)_9-12.nxml,Unc112 A New Regulator of CellExtracellular Matrix Adhesions?,the journal of cell biology,RPG-96-021-04-CSM,10,Unc112 A New Regulator of Cell–Extracellular Matrix Adhesions?
articles.I-N,J_Cell_Biol,J_Cell_Biol_2009_Feb_9_184(3)_373-381.nxml,Intrakinetochore stretch is associated with changes in kinetochore phosphorylation and spindle assembly checkpoint activity,the journal of cell biology,PF0711401,111,Intrakinetochore stretch is associated with changes in kinetochore phosphorylation and spindle assembly checkpoint activity
articles.I-N,J_Cell_Biol,J_Cell_Biol_1997_Jun_30_137(7)_1511-1524.nxml,The Yeast v-SNARE Vti1p Mediates Two Vesicle Transport Pathways  through Interactions with the t-SNAREs Sed5p and Pep12p,the journal of cell biology,PF-3608,185,The Yeast v-SNARE Vti1p Mediates Two Vesicle Transport Pathways  through Interactions with the t-SNAREs Sed5p and Pep12p
articles.I-N,J_Cell_Biol,J_Cell_Biol_1998_Aug_24_142(4)_1023-1034.nxml,Characterization of the p22 Subunit of Dynactin Reveals the Localization of Cytoplasmic Dynein and Dynactin to the Midbody of Dividing Cells,the journal of cell biology,CB-186,65,Characterization of the p22 Subunit of Dynactin Reveals the Localization of Cytoplasmic Dynein and Dynactin to the Midbody of Dividing Cells
articles.I-N,J_Cell_Biol,J_Cell_Biol_2002_Sep_2_158(5)_915-927.nxml,Proteomic analysis of the mammalian nuclear pore complex,the journal of cell biology,RSG-01-064-01-CSM,759,Proteomic analysis of the mammalian nuclear pore complex
articles.I-N,J_Cell_Biol,J_Cell_Biol_2008_Sep_8_182(5)_845-853.nxml,Rab13 regulates membrane trafficking between TGN and recycling endosomes in polarized epithelial cells,the journal of cell biology,IRG-93-037-09,44,Rab13 regulates membrane trafficking between TGN and recycling endosomes in polarized epithelial cells
articles.I-N,J_Cell_Biol,J_Cell_Biol_2004_Aug_16_166(4)_455-463.nxml,Dynamic targeting of the replication machinery to sites of DNA damage,the journal of cell biology,RSG-01-254-ECG,68,Dynamic targeting of the replication machinery to sites of DNA damage
articles.I-N,J_Cell_Biol,J_Cell_Biol_2004_Aug_30_166(5)_717-729.nxml,Bro1 coordinates deubiquitination in the multivesicular body pathway by recruiting Doa4 to endosomes,the journal of cell biology,RSG-02-147-01,162,Bro1 coordinates deubiquitination in the multivesicular body pathway by recruiting Doa4 to endosomes
articles.I-N,J_Cell_Biol,J_Cell_Biol_2009_Jun_15_185(6)_995-1012.nxml,Role of Inn1 and its interactions with Hof1 and Cyk3 in promoting cleavage furrow and septum formation in S. cerevisiae,the journal of cell biology,RSG-02-039-01-CSM,43,Role of Inn1 and its interactions with Hof1 and Cyk3 in promoting cleavage furrow and septum formation in S. cerevisiae
articles.I-N,J_Cell_Biol,J_Cell_Biol_2012_Jan_9_196(1)_47-64.nxml,Dynein-dependent processive chromosome motions promote homologous pairing in C. elegans meiosis In vivo imaging of meiotic chromosome dynamics,the journal of cell biology,RSG-07-187-01-GMC,21,Dynein-dependent processive chromosome motions promote homologous pairing in C. elegans meiosis In vivo imaging of meiotic chromosome dynamics
articles.I-N,J_Cell_Biol,J_Cell_Biol_2004_Mar_15_164(6)_843-850.nxml,In vitro FRAP reveals the ATP-dependent nuclear mobilization of the exon junction complex protein SRm160,the journal of cell biology,RPG-99-262-01-GMC,25,In vitro FRAP reveals the ATP-dependent nuclear mobilization of the exon junction complex protein SRm160
articles.I-N,J_Cell_Biol,J_Cell_Biol_1998_Oct_19_143(2)_333-349.nxml,The Dynamin-related GTPase  Dnm1p  Controls Mitochondrial Morphology in Yeast,the journal of cell biology,CB-97,321,The Dynamin-related GTPase  Dnm1p  Controls Mitochondrial Morphology in Yeast
articles.I-N,J_Cell_Biol,J_Cell_Biol_1999_May_17_145(4)_837-849.nxml,p21-Activated Kinase 1 (Pak1) Regulates Cell Motility in Mammalian Fibroblasts,the journal of cell biology,CB-189,353,p21-Activated Kinase 1 (Pak1) Regulates Cell Motility in Mammalian Fibroblasts
articles.I-N,J_Cell_Biol,J_Cell_Biol_1998_Oct_5_143(1)_121-133.nxml,Why Are Two Different Cross-linkers Necessary for Actin Bundle Formation In Vivo and What Does Each Cross-link Contribute?,the journal of cell biology,RPG-92-014-05,108,Why Are Two Different Cross-linkers Necessary for Actin Bundle Formation In Vivo and What Does Each Cross-link Contribute?
articles.I-N,J_Cell_Biol,J_Cell_Biol_2004_Nov_22_167(4)_649-659.nxml,Ubiquitin charging of human class III ubiquitin-conjugating enzymes triggers their nuclear import,the journal of cell biology,PF-02-032-01-CCG,71,Ubiquitin charging of human class III ubiquitin-conjugating enzymes triggers their nuclear import
articles.I-N,J_Cell_Biol,J_Cell_Biol_2010_Nov_29_191(5)_923-931.nxml,Defects in nuclear pore assembly lead to activation of an Aurora Bmediated abscission checkpoint Nuclear pore complex assembly and an abscission checkpoint,the journal of cell biology,PF-07-103-01-CSM,27,Defects in nuclear pore assembly lead to activation of an Aurora B–mediated abscission checkpoint Nuclear pore complex assembly and an abscission checkpoint
articles.I-N,J_Cell_Biol,J_Cell_Biol_2005_Jul_18_170(2)_225-235.nxml,The nuclear pore complexassociated protein  Mlp2p  binds to the yeast spindle pole body and promotes its efficient assembly,the journal of cell biology,RSG-04-042-51,53,The nuclear pore complexassociated protein  Mlp2p  binds to the yeast spindle pole body and promotes its efficient assembly
articles.I-N,J_Cell_Biol,J_Cell_Biol_1998_Sep_7_142(5)_1289-1299.nxml,The Yeast V159N Actin Mutant Reveals Roles for Actin Dynamics In Vivo,the journal of cell biology,FRA-442,98,The Yeast V159N Actin Mutant Reveals Roles for Actin Dynamics In Vivo
articles.I-N,J_Cell_Biol,J_Cell_Biol_2010_Apr_19_189(2)_261-274.nxml,Hsp90Sgt1 and Skp1 target human Mis12 complexes to ensure efficient formation of kinetochoremicrotubule binding sites Hsp90-Sgt1 targets the Mis12 kinetochore complex,the journal of cell biology,RSG-02-035-05-CCG,22,Hsp90 Sgt1 and Skp1 target human Mis12 complexes to ensure efficient formation of kinetochore–microtubule binding sites Hsp90-Sgt1 targets the Mis12 kinetochore complex
articles.I-N,J_Cell_Biol,J_Cell_Biol_2003_Sep_1_162(5)_889-898.nxml,Wnt-5/ pipetail functions in vertebrate axis formation as a negative regulator of Wnt/-catenin activity,the journal of cell biology,IN-122V,213,Wnt-5/ pipetail functions in vertebrate axis formation as a negative regulator of Wnt/-catenin activity
articles.I-N,J_Cell_Biol,J_Cell_Biol_2010_Dec_27_191(7)_1333-1350.nxml,Biphasic targeting and cleavage furrow ingression directed by the tail of a myosin II Myo1 tail-mediated targeting and furrow ingression,the journal of cell biology,RSG-02-039-01-CSM,41,Biphasic targeting and cleavage furrow ingression directed by the tail of a myosin II Myo1 tail-mediated targeting and furrow ingression
articles.I-N,J_Cell_Biol,J_Cell_Biol_2001_Dec_10_155(6)_911-922.nxml,BRCA1-induced large-scale chromatin unfolding and allele-specific effects of cancer-predisposing mutations,the journal of cell biology,RPG99-211-01-MBC,163,BRCA1-induced large-scale chromatin unfolding and allele-specific effects of cancer-predisposing mutations
articles.I-N,J_Cell_Biol,J_Cell_Biol_2002_Aug_5_158(3)_497-506.nxml,Active translocon complexes labeled with GFPDad1 diffuse slowly as large polysome arrays in the endoplasmic reticulum,the journal of cell biology,RPG-92-009-06-CB,61,Active translocon complexes labeled with GFP–Dad1 diffuse slowly as large polysome arrays in the endoplasmic reticulum
articles.I-N,J_Cell_Biol,J_Cell_Biol_2009_Feb_9_184(3)_437-450.nxml,An essential role for p120-catenin in Src- and Rac1-mediated anchorage-independent cell growth,the journal of cell biology,PF-04-103-01-CSM,38,An essential role for p120-catenin in Src- and Rac1-mediated anchorage-independent cell growth
articles.I-N,J_Cell_Biol,J_Cell_Biol_2007_May_21_177(4)_587-597.nxml,The acetyltransferase activity of San stabilizes the mitotic cohesin at the centromeres in a shugoshin-independent manner,the journal of cell biology,RSG-04-171-01-CCG,38,The acetyltransferase activity of San stabilizes the mitotic cohesin at the centromeres in a shugoshin-independent manner
articles.I-N,J_Cell_Biol,J_Cell_Biol_2000_Dec_25_151(7)_1449-1458.nxml,Temporal and Spatial Distribution of Activated Pak1 in Fibroblasts,the journal of cell biology,CB-189,146,Temporal and Spatial Distribution of Activated Pak1 in Fibroblasts
articles.I-N,J_Cell_Biol,J_Cell_Biol_2002_Jan_21_156(2)_249-260.nxml,The checkpoint protein Chfr is a ligase that ubiquitinates Plk1 and inhibits Cdc2 at the G2 to M transition,the journal of cell biology,RSG-01-143-01,174,The checkpoint protein Chfr is a ligase that ubiquitinates Plk1 and inhibits Cdc2 at the G2 to M transition
articles.I-N,J_Cell_Biol,J_Cell_Biol_1997_Oct_20_139(2)_351-363.nxml,The Phosphatidylinositol Transfer Protein Domain of Drosophila Retinal Degeneration B Protein Is Essential for Photoreceptor Cell Survival and Recovery from Light Stimulation,the journal of cell biology,BE232,111,The Phosphatidylinositol Transfer Protein Domain of Drosophila Retinal Degeneration B Protein Is Essential for Photoreceptor Cell Survival and Recovery from Light Stimulation
articles.I-N,J_Cell_Biol,J_Cell_Biol_2002_May_13_157(4)_631-643.nxml,The Sec34/Sec35p complex  a Ypt1p effector required for retrograde intra-Golgi trafficking  interacts with Golgi SNAREs and COPI vesicle coat proteins,the journal of cell biology,IRG 91-021-08,147,The Sec34/Sec35p complex  a Ypt1p effector required for retrograde intra-Golgi trafficking  interacts with Golgi SNAREs and COPI vesicle coat proteins
articles.I-N,J_Cell_Biol,J_Cell_Biol_2008_Mar_24_180(6)_1245-1260.nxml,WASP family members and formin proteins coordinate regulation of cell protrusions in carcinoma cells,the journal of cell biology,RSG-05-033-01-CSM,89,WASP family members and formin proteins coordinate regulation of cell protrusions in carcinoma cells
articles.I-N,J_Cell_Biol,J_Cell_Biol_2004_Nov_8_167(3)_519-530.nxml,Live cell imaging of the assembly  disassembly  and actin cabledependent movement of endosomes and actin patches in the budding yeast  Saccharomyces cerevisiae,the journal of cell biology,RPG-97-163-04-CSM,148,Live cell imaging of the assembly  disassembly  and actin cable–dependent movement of endosomes and actin patches in the budding yeast  Saccharomyces cerevisiae
articles.I-N,J_Cell_Biol,J_Cell_Biol_1998_Sep_21_142(6)_1547-1558.nxml,Active MAP Kinase in Mitosis: Localization at Kinetochores and Association with the Motor Protein CENP-E,the journal of cell biology,CB-84,200,Active MAP Kinase in Mitosis: Localization at Kinetochores and Association with the Motor Protein CENP-E
articles.I-N,J_Cell_Biol,J_Cell_Biol_2008_Jun_30_181(7)_1073-1081.nxml,Cleavage of the signaling mucin Msb2 by the aspartyl protease Yps1 is required for MAPK activation in yeast,the journal of cell biology,TBE-114083,57,Cleavage of the signaling mucin Msb2 by the aspartyl protease Yps1 is required for MAPK activation in yeast
articles.I-N,J_Cell_Biol,J_Cell_Biol_2001_Feb_19_152(4)_809-824.nxml,Distinct Protein Sorting and Localization to Premelanosomes  Melanosomes  and Lysosomes in Pigmented Melanocytic Cells ✪,the journal of cell biology,PF-99-336-01-CIM,260,Distinct Protein Sorting and Localization to Premelanosomes  Melanosomes  and Lysosomes in Pigmented Melanocytic Cells ✪
articles.I-N,J_Cell_Biol,J_Cell_Biol_2005_Dec_5_171(5)_845-855.nxml,Self-organization of an acentrosomal microtubule network at the basal cortex of polarized epithelial cells,the journal of cell biology,PF-03-016-01-CSM,42,Self-organization of an acentrosomal microtubule network at the basal cortex of polarized epithelial cells
articles.I-N,J_Cell_Biol,J_Cell_Biol_2009_Jan_26_184(2)_225-239.nxml,The SCF Slimb ubiquitin ligase regulates Plk4/Sak levels to block centriole reduplication,the journal of cell biology,PF-06-108-01-CCG,92,The SCF Slimb ubiquitin ligase regulates Plk4/Sak levels to block centriole reduplication
articles.I-N,J_Cell_Biol,J_Cell_Biol_2011_Apr_18_193(2)_285-294.nxml,Chromosome passenger complexes control anaphase duration and spindle elongation via a kinesin-5 brake Passengers regulate spindle elongation,the journal of cell biology,RSG-02-035-05-CCG,7,Chromosome passenger complexes control anaphase duration and spindle elongation via a kinesin-5 brake Passengers regulate spindle elongation
articles.I-N,J_Cell_Biol,J_Cell_Biol_2010_Apr_19_189(2)_233-246.nxml,Continued primer synthesis at stalled replication forks contributes to checkpoint activation Primer synthesis affects checkpoint activation,the journal of cell biology,RSG-05-028-01,33,Continued primer synthesis at stalled replication forks contributes to checkpoint activation Primer synthesis affects checkpoint activation
articles.I-N,J_Cell_Biol,J_Cell_Biol_2012_Aug_6_198(3)_405-420.nxml,Seg1 controls eisosome assembly and shape Seg1 controls eisosome assembly and shape,the journal of cell biology,IRG-82-003-26,4,Seg1 controls eisosome assembly and shape Seg1 controls eisosome assembly and shape
articles.I-N,J_Cell_Biol,J_Cell_Biol_2003_May_12_161(3)_521-533.nxml,Proprotein convertase cleavage liberates a fibrillogenic fragment of a resident glycoprotein to initiate melanosome biogenesis,the journal of cell biology,PF-99-336-01-CIM,184,Proprotein convertase cleavage liberates a fibrillogenic fragment of a resident glycoprotein to initiate melanosome biogenesis
articles.I-N,J_Cell_Biol,J_Cell_Biol_2012_Jul_23_198(2)_205-217.nxml,CENP-Edependent BubR1 autophosphorylation enhances chromosome alignment and the mitotic checkpoint CENP-Edependent BubR1 autophosphorylation,the journal of cell biology,RSG-09-027-01-CCG,16,CENP-E–dependent BubR1 autophosphorylation enhances chromosome alignment and the mitotic checkpoint CENP-E–dependent BubR1 autophosphorylation
