articles.I-N,J_Cell_Biol,J_Cell_Biol_2011_May_16_193(4)_711-725.nxml,Centrobintubulin interaction is required for centriole elongation and stability Centrobintubulin binding in centriole duplication,the journal of cell biology,RSG-03-048-01,16,Centrobin–tubulin interaction is required for centriole elongation and stability Centrobin–tubulin binding in centriole duplication
articles.I-N,J_Cell_Biol,J_Cell_Biol_2008_Oct_6_183(1)_49-61.nxml,Cdk2 and Pin1 negatively regulate the transcriptional corepressor SMRT,the journal of cell biology,RSG-04-052-01-GMC,36,Cdk2 and Pin1 negatively regulate the transcriptional corepressor SMRT
articles.I-N,J_Cell_Biol,J_Cell_Biol_2008_Feb_25_180(4)_691-696.nxml,FOXO-regulated transcription restricts overgrowth of Tsc mutant organs,the journal of cell biology,DDC-105895,35,FOXO-regulated transcription restricts overgrowth of Tsc mutant organs
articles.I-N,J_Cell_Biol,J_Cell_Biol_2005_Dec_19_171(6)_1023-1034.nxml,Distinct roles of Akt1 and Akt2 in regulating cell migration and epithelialmesenchymal transition,the journal of cell biology,PF-04-072-01-TBE,386,Distinct roles of Akt1 and Akt2 in regulating cell migration and epithelial–mesenchymal transition
articles.I-N,J_Cell_Biol,J_Cell_Biol_2003_Jun_9_161(5)_979-989.nxml,Neuroglian  Gliotactin  and the Na + /K + ATPase are essential for septate junction function in Drosophila,the journal of cell biology,RPG-97-026-04-DDC,134,Neuroglian  Gliotactin  and the Na + /K + ATPase are essential for septate junction function in Drosophila
articles.I-N,Nature,Nature_2010_Oct_7_467(7316)_678-683.nxml,Purified human BRCA2 stimulates RAD51-mediated recombination,nature,PF-05-225-01-GMC,151,Purified human BRCA2 stimulates RAD51-mediated recombination
articles.I-N,Nature,Nature_2013_Oct_24_502(7472)_513-518.nxml,Spatial organization within a niche as a determinant of stem cell fate,nature,RGS-12-059-01-DCC,21,Spatial organization within a niche as a determinant of stem cell fate
articles.I-N,Nature,Nature_2011_Jan_6_469(7328)_102-106.nxml,Telomerase reactivation reverses tissue degeneration in aged telomerase deficient mice,nature,PF-08-261-01-TBE,263,Telomerase reactivation reverses tissue degeneration in aged telomerase deficient mice
articles.I-N,Nature,Nature_2010_Sep_9_467(7312)_218-222.nxml,MEC-17 is an -tubulin acetyltransferase,nature,RSG DDC-112979,119,MEC-17 is an -tubulin acetyltransferase
articles.I-N,Nature,Nature_2010_Dec_9_468(7325)_779-783.nxml,Cap binding and immune evasion revealed by Lassa nucleoprotein structure,nature,RSG-06-162-01-GMC,95,Cap binding and immune evasion revealed by Lassa nucleoprotein structure
articles.I-N,Nature,Nature_2011_Dec_1_480(7375)_118-122.nxml,Nuclear PKM2 regulates -catenin transactivation upon EGFR activation,nature,RSG-09-277-01-CSM,162,Nuclear PKM2 regulates catenin transactivation upon EGFR activation
articles.I-N,Nature,Nature_2012_Jan_11_482(7384)_186-191.nxml,Complete subunit architecture of the proteasome regulatory particle,nature,PF-11-178-01-TBE,163,Complete subunit architecture of the proteasome regulatory particle
articles.I-N,Nature,Nature_2013_Jan_3_493(7430)_106-110.nxml,Restriction of intestinal stem cell expansion and the regenerative response by YAP,nature,PF-12-245-01-CCG,40,Restriction of intestinal stem cell expansion and the regenerative response by YAP
articles.I-N,Nature,Nature_2010_Jun_24_465(7301)_1093-1096.nxml,Activation of autophagy during cell death requires the engulfment receptor Draper,nature,PF-07-258-01-CSM,53,Activation of autophagy during cell death requires the engulfment receptor Draper
articles.I-N,Nature,Nature_2012_Jul_19_487(7407)_370-374.nxml,Proto-genes and de novo gene birth,nature,PF-09-136-01-RMC,70,Proto-genes and de novo gene birth
articles.I-N,Nature,Nature_2011_Feb_3_470(7332)_124-128.nxml,MMSET regulates histone H4K20 methylation and 53BP1 accumulation at DNA damage sites,nature,IRG-58-010-52,168,MMSET regulates histone H4K20 methylation and 53BP1 accumulation at DNA damage sites
articles.I-N,Nature,Nature_2013_May_9_497(7448)_244-248.nxml,A role for the Perlman syndrome exonuclease Dis3l2 in the Lin28-let-7 pathway,nature,RSG-11-175-01-RMC,30,A role for the Perlman syndrome exonuclease Dis3l2 in the Lin28-let-7 pathway
articles.I-N,Nature,Nature_2010_Nov_18_468(7322)_461-464.nxml,Integrating Carbon-Halogen Bond Formation into Medicinal Plant Metabolism,nature,RSG-07-025-01-CDD,51,Integrating Carbon-Halogen Bond Formation into Medicinal Plant Metabolism
articles.I-N,Nature,Nature_2012_Aug_16_488(7411)_337-342.nxml,Passenger Deletions Generate Therapeutic Vulnerabilities in Cancer,nature,PF-08-261-01-TBE,36,Passenger Deletions Generate Therapeutic Vulnerabilities in Cancer
articles.I-N,Nature,Nature_2013_Sep_5_501(7465)_58-62.nxml,Topoisomerases facilitate transcription of long genes linked to autism,nature,PF-09-124-01-DDC,35,Topoisomerases facilitate transcription of long genes linked to autism
articles.I-N,J_Invest_Dermatol,J_Invest_Dermatol_2013_Mar_29_133(3)_642-646.nxml,Systemic immune suppression as a stage-independent predictor of diminished Merkel cell carcinoma-specific survival,the journal of investigative dermatology,RSG-08-115-01-CCE,3,Systemic immune suppression as a stage-independent predictor of diminished Merkel cell carcinoma-specific survival
articles.I-N,J_Invest_Dermatol,J_Invest_Dermatol_2011_Sep_19_131(9)_1817-1820.nxml,Intratumoral Decorin Gene Delivery by AAV Vector Inhibits Brain Glioblastomas and Prolongs Survival of Animals by Inducing Cell Differentiation,the journal of investigative dermatology,RSG-08-03-01-CSM,0,Intratumoral Decorin Gene Delivery by AAV Vector Inhibits Brain Glioblastomas and Prolongs Survival of Animals by Inducing Cell Differentiation
articles.I-N,J_Invest_Dermatol,J_Invest_Dermatol_2013_Aug_25_133(8)_2065-2073.nxml,Vascular E-selectin expression correlates with CD8 lymphocyte infiltration and improved outcome in Merkel cell carcinoma,the journal of investigative dermatology,RSG-08-115-01-CCE,3,Vascular E-selectin expression correlates with CD8 lymphocyte infiltration and improved outcome in Merkel cell carcinoma
articles.I-N,Int_J_Mol_Sci,Int_J_Mol_Sci_2013_Jul_9_14(7)_14240-14269.nxml,Intercellular Communication by Exosome-Derived microRNAs in Cancer,international journal of molecular sciences,CNE-117557,19,Intercellular Communication by Exosome-Derived microRNAs in Cancer
articles.I-N,Int_J_Mol_Sci,Int_J_Mol_Sci_2013_Sep_5_14(9)_18319-18349.nxml,Noncoding RNA in Oncogenesis: A New Era of Identifying Key Players,international journal of molecular sciences,RSG-09-082-01-MGO,5,Noncoding RNA in Oncogenesis: A New Era of Identifying Key Players
articles.I-N,Int_J_Mol_Sci,Int_J_Mol_Sci_2013_Feb_28_14(3)_4762-4782.nxml,Gonadotropins Activate Oncogenic Pathways to Enhance Proliferation in Normal Mouse Ovarian Surface Epithelium,international journal of molecular sciences,RSG-12-230-01-TBG,7,Gonadotropins Activate Oncogenic Pathways to Enhance Proliferation in Normal Mouse Ovarian Surface Epithelium
articles.I-N,Int_J_Mol_Sci,Int_J_Mol_Sci_2014_Mar_12_15(3)_4393-4414.nxml,Intratumoral Decorin Gene Delivery by AAV Vector Inhibits Brain Glioblastomas and Prolongs Survival of Animals by Inducing Cell Differentiation,international journal of molecular sciences,RSG CSM-107144,0,Intratumoral Decorin Gene Delivery by AAV Vector Inhibits Brain Glioblastomas and Prolongs Survival of Animals by Inducing Cell Differentiation
articles.I-N,Int_J_Mol_Sci,Int_J_Mol_Sci_2013_Jul_16_14(7)_14800-14832.nxml,Molecularly Targeted Agents as Radiosensitizers in Cancer TherapyFocus on Prostate Cancer,international journal of molecular sciences,RSG-12-196-01-TBG,3,Molecularly Targeted Agents as Radiosensitizers in Cancer TherapyFocus on Prostate Cancer
articles.I-N,Int_J_Mol_Sci,Int_J_Mol_Sci_2012_Nov_26_13(12)_15755-15766.nxml,ROR  a Potential Tumor Suppressor and Therapeutic Target of Breast Cancer,international journal of molecular sciences,IRG 85-001-22,5,ROR  a Potential Tumor Suppressor and Therapeutic Target of Breast Cancer
articles.I-N,Int_J_Mol_Sci,Int_J_Mol_Sci_2012_Oct_12_13(10)_13134-13139.nxml,A Tumor Surveillance Model: A Non-Coding RNA Senses Neoplastic Cells and Its Protein Partner Signals Cell Death,international journal of molecular sciences,RSG-12-187-01-RMC,0,A Tumor Surveillance Model: A Non-Coding RNA Senses Neoplastic Cells and Its Protein Partner Signals Cell Death
articles.I-N,Mol_Biol_Evol,Mol_Biol_Evol_2010_Mar_18_27(3)_609-621.nxml,Comparing Models of Evolution for Ordered and Disordered Proteins,molecular biology and evolution,RSG-07-289-01-GMC,63,Comparing Models of Evolution for Ordered and Disordered Proteins
articles.I-N,Nat_Genet,Nat_Genet_2012_Nov_23_44(11)_1191-1198.nxml,Breast cancer risk-associated SNPs modulate the affinity of chromatin for FOXA1 and alter gene expression,nature genetics,IRG-82-003-27,33,Breast cancer risk-associated SNPs modulate the affinity of chromatin for FOXA1 and alter gene expression
articles.I-N,Nat_Genet,Nat_Genet_2010_Aug_18_42(8)_661-664.nxml,Genome-wide association study of follicular lymphoma identifies a risk locus at 6p21.32,nature genetics,IRG-07-06401,76,Genome-wide association study of follicular lymphoma identifies a risk locus at 6p21.32
articles.I-N,Nat_Genet,Nat_Genet_2012_Jul_1_44(8)_852-860.nxml,Activation of the AXL Kinase Causes Resistance to EGFR -Targeted Therapy in Lung Cancer,nature genetics,RSG-08-303-01,151,Activation of the AXL kinase causes resistance to EGFR-targeted therapy in lung cancer
articles.I-N,Nucleic_Acids_Res,Nucleic_Acids_Res_2005_May_4_33(8)_2565-2579.nxml,Alternative polyadenylation of cyclooxygenase-2,nucleic acids research,RPG-00-265-01-GMC,67,Alternative polyadenylation of cyclooxygenase-2
articles.I-N,Nucleic_Acids_Res,Nucleic_Acids_Res_2008_Mar_7_36(5)_1731-1740.nxml,Substitution of a residue contacting the triphosphate moiety of the incoming nucleotide increases the fidelity of yeast DNA polymerase ζ,nucleic acids research,RSG-05-139-01-GMC,7,Substitution of a residue contacting the triphosphate moiety of the incoming nucleotide increases the fidelity of yeast DNA polymerase ζ
articles.I-N,Nucleic_Acids_Res,Nucleic_Acids_Res_2008_Jul_24_36(12)_e69.nxml,Efficient cytosolic delivery of molecular beacon conjugates and flow cytometric analysis of target RNA,nucleic acids research,RSG-07-005-01,43,Efficient cytosolic delivery of molecular beacon conjugates and flow cytometric analysis of target RNA
articles.I-N,Nucleic_Acids_Res,Nucleic_Acids_Res_2006_Feb_28_34(4)_1196-1204.nxml,Gamma radiation increases endonuclease-dependent L1 retrotransposition in a cultured cell assay,nucleic acids research,IRG-78-002-25,73,Gamma radiation increases endonuclease-dependent L1 retrotransposition in a cultured cell assay
articles.I-N,Nucleic_Acids_Res,Nucleic_Acids_Res_2007_Aug_15_35(16)_e105.nxml,Avoiding false-positive signals with nuclease-vulnerable molecular beacons in single living cells,nucleic acids research,RSG-07-005-01,67,Avoiding false-positive signals with nuclease-vulnerable molecular beacons in single living cells
articles.I-N,Nucleic_Acids_Res,Nucleic_Acids_Res_2005_Jan_13_33(1)_e8.nxml,Use of a restriction enzyme-digested PCR product as substrate for helicase assays,nucleic acids research,RSG-04-050-01-GMC,4,Use of a restriction enzyme-digested PCR product as substrate for helicase assays
articles.I-N,Nucleic_Acids_Res,Nucleic_Acids_Res_2007_Nov_4_35(20)_6750-6761.nxml,Discovery of a mRNA mitochondrial localization element in Saccharomyces cerevisiae by nonhomologous random recombination and in vivo selection,nucleic acids research,RSG-02-066-01-MGO,5,Discovery of a mRNA mitochondrial localization element in Saccharomyces cerevisiae by nonhomologous random recombination and in vivo selection
articles.I-N,Nucleic_Acids_Res,Nucleic_Acids_Res_2006_Oct_10_34(17)_4722-4730.nxml,Site-directed spin labeling measurements of nanometer distances in nucleic acids using a sequence-independent nitroxide probe,nucleic acids research,IRG-58-007-45,86,Site-directed spin labeling measurements of nanometer distances in nucleic acids using a sequence-independent nitroxide probe
articles.I-N,Nucleic_Acids_Res,Nucleic_Acids_Res_2006_Dec_15_34(21)_6337-6344.nxml,Stimulation of MCM helicase activity by a Cdc6 protein in the archaeon Thermoplasma acidophilum,nucleic acids research,RSG-04-050-01-GMC,31,Stimulation of MCM helicase activity by a Cdc6 protein in the archaeon Thermoplasma acidophilum
articles.I-N,Nucleic_Acids_Res,Nucleic_Acids_Res_2006_Sep_26_34(15)_4106-4114.nxml,RecQ helicases: lessons from model organisms,nucleic acids research,PF-01-142-01-CCG,55,RecQ helicases: lessons from model organisms
articles.I-N,Nucleic_Acids_Res,Nucleic_Acids_Res_2006_Apr_28_34(8)_2173-2185.nxml,The molecular mechanism of DNA damage recognition by MutS homologs and its consequences for cell death response,nucleic acids research,RSG-04-187-01-GMC,42,The molecular mechanism of DNA damage recognition by MutS homologs and its consequences for cell death response
articles.I-N,Nucleic_Acids_Res,Nucleic_Acids_Res_2005_Jan_12_33(1)_201-212.nxml,A large-scale analysis of mRNA polyadenylation of human and mouse genes,nucleic acids research,RPG-00-265-01-GMC,398,A large-scale analysis of mRNA polyadenylation of human and mouse genes
articles.I-N,Nucleic_Acids_Res,Nucleic_Acids_Res_2005_Mar_1_33(4)_1298-1308.nxml,Leaky ribosomal scanning in mammalian genomes: significance of histone H4 alternative translation in vivo,nucleic acids research,IRG-58-007-40,24,Leaky ribosomal scanning in mammalian genomes: significance of histone H4 alternative translation in vivo
articles.I-N,Nucleic_Acids_Res,Nucleic_Acids_Res_2006_May_31_34(10)_3057-3066.nxml,Structural analysis of hyperperiodic DNA from Caenorhabditis elegans,nucleic acids research,PF-05-121-01-DDC,25,Structural analysis of hyperperiodic DNA from Caenorhabditis elegans
articles.I-N,Nucleic_Acids_Res,Nucleic_Acids_Res_2012_Jul_30_40(13)_5795-5818.nxml,Homologous recombination and its regulation,nucleic acids research,RSG-12-013-01-CCG,91,Homologous recombination and its regulation
articles.I-N,Nucleic_Acids_Res,Nucleic_Acids_Res_2007_May_22_35(10)_3272-3286.nxml,Defining the mode  energetics and specificity with which a macrocyclic hexaoxazole binds to human telomeric G-quadruplex DNA,nucleic acids research,RSG-99-153-04-CDD,55,Defining the mode  energetics and specificity with which a macrocyclic hexaoxazole binds to human telomeric G-quadruplex DNA
articles.I-N,Nucleic_Acids_Res,Nucleic_Acids_Res_2006_Feb_6_34(3)_840-852.nxml,Molecular models for the tissue specificity of DNA mismatch repair-deficient carcinogenesis,nucleic acids research,CCE-02-153-01,79,Molecular models for the tissue specificity of DNA mismatch repair-deficient carcinogenesis
articles.I-N,Nucleic_Acids_Res,Nucleic_Acids_Res_2006_Apr_13_34(7)_e53.nxml,Polycistronic RNA polymerase II expression vectors for RNA interference based on BIC/miR-155,nucleic acids research,RSG-01-177-01-MGO,246,Polycistronic RNA polymerase II expression vectors for RNA interference based on BIC/miR-155
articles.I-N,Nucleic_Acids_Res,Nucleic_Acids_Res_2008_Mar_9_36(4)_1309-1320.nxml,Coupling of DNA binding and helicase activity is mediated by a conserved loop in the MCM protein,nucleic acids research,RSG-04-050-01-GMC,29,Coupling of DNA binding and helicase activity is mediated by a conserved loop in the MCM protein
articles.I-N,Nucleic_Acids_Res,Nucleic_Acids_Res_2007_Jun_30_35(12)_3928-3944.nxml,Proteomic analysis of in vivo -assembled pre-mRNA splicing complexes expands the catalog of participating factors,nucleic acids research,RSG-05-137-01-MCB,71,Proteomic analysis of in vivo -assembled pre-mRNA splicing complexes expands the catalog of participating factors
articles.I-N,Nucleic_Acids_Res,Nucleic_Acids_Res_2008_May_10_36(8)_2547-2560.nxml,A systematic characterization of factors that regulate Drosophila segmentation via a bacterial one-hybrid system,nucleic acids research,RSG-05-026-01-CCG,80,A systematic characterization of factors that regulate Drosophila segmentation via a bacterial one-hybrid system
articles.I-N,Nucleic_Acids_Res,Nucleic_Acids_Res_2005_Sep_8_33(15)_4940-4950.nxml,Interactions between the archaeal Cdc6 and MCM proteins modulate their biochemical properties,nucleic acids research,RSG-04-050-01-GMC,44,Interactions between the archaeal Cdc6 and MCM proteins modulate their biochemical properties
articles.I-N,Nucleic_Acids_Res,Nucleic_Acids_Res_2005_Jul_1_33(Web_Server_issue)_W184-W187.nxml,GPS: a comprehensive www server for phosphorylation sites prediction,nucleic acids research,RPG-99-173-01,132,GPS: a comprehensive www server for phosphorylation sites prediction
articles.I-N,Nucleic_Acids_Res,Nucleic_Acids_Res_2006_Jul_1_34(Web_Server_issue)_W254-W257.nxml,SUMOsp: a web server for sumoylation site prediction,nucleic acids research,RPG-99-173-01,121,SUMOsp: a web server for sumoylation site prediction
articles.I-N,Nucleic_Acids_Res,Nucleic_Acids_Res_2008_Feb_15_36(3)_732-741.nxml,Developmentally regulated cleavage of tRNAs in the bacterium Streptomyces coelicolor,nucleic acids research,PF-07-058-01-GMC,53,Developmentally regulated cleavage of tRNAs in the bacterium Streptomyces coelicolor
articles.I-N,Nucleic_Acids_Res,Nucleic_Acids_Res_2007_Jan_27_35(Database_issue)_D810-D814.nxml,Organelle DB: an updated resource of eukaryotic protein localization and function,nucleic acids research,RSG-06-179-01-MBC,24,Organelle DB: an updated resource of eukaryotic protein localization and function
articles.I-N,mBio,mBio_2013_Jul_9_4(4)_e00255-13.nxml,Human Innate Immunity to Toxoplasma gondii Is Mediated by Host Caspase-1 and ASC and Parasite GRA15  T.gondii Induction of IL-1 in Human Monocytes,mbio,IRG-98-279-07,6,Human Innate Immunity to Toxoplasma gondii Is Mediated by Host Caspase-1 and ASC and Parasite GRA15  T.gondii Induction of IL-1 in Human Monocytes
articles.I-N,mBio,mBio_2013_May_28_4(3)_e00282-13.nxml,Cyclic di-AMP Is Critical for Listeria monocytogenes Growth  Cell Wall Homeostasis  and Establishment of Infection c-di-AMP in Listeria monocytogenes,mbio,PF-07-066-01-LIB,11,Cyclic di-AMP Is Critical for Listeria monocytogenes Growth  Cell Wall Homeostasis  and Establishment of Infection c-di-AMP in Listeria monocytogenes
articles.I-N,mBio,mBio_2014_Apr_1_5(2)_e01111-13.nxml,Shear Forces Enhance Toxoplasma gondii Tachyzoite Motility on Vascular Endothelium  T.gondii Interactions with Endothelium in Shear Flow,mbio,IRG-98-279-07,0,Shear Forces Enhance Toxoplasma gondii Tachyzoite Motility on Vascular Endothelium  T.gondii Interactions with Endothelium in Shear Flow
articles.I-N,mBio,mBio_2012_Mar_23_3(2)_e00063-12.nxml,Visualization of an Alphaherpesvirus Membrane Protein That Is Essential for Anterograde Axonal Spread of Infection in Neurons Imaging of GFP-Us9 Anterograde Axonal Transport,mbio,PF-10-057-01-MPC,12,Visualization of an Alphaherpesvirus Membrane Protein That Is Essential for Anterograde Axonal Spread of Infection in Neurons Imaging of GFP-Us9 Anterograde Axonal Transport
articles.I-N,Nat_Med,Nat_Med_2012_Feb_6_18(2)_298-301.nxml,Genetic Inactivation of the PRC2 Complex in T-Cell Acute Lymphoblastic Leukemia,nature medicine,RSG0806801,89,Genetic Inactivation of the PRC2 Complex in T-Cell Acute Lymphoblastic Leukemia
articles.I-N,Nat_Med,Nat_Med_2012_Jan_8_18(2)_281-285.nxml,Identification of the Niemann-Pick C1-like 1 cholesterol absorption receptor as a new hepatitis C virus entry factor,nature medicine,RSG-09-076-01-SLU,152,Identification of the Niemann-Pick C1-like 1 cholesterol absorption receptor as a new hepatitis C virus entry factor
articles.I-N,Nat_Med,Nat_Med_2009_Jan_21_15(1)_50-58.nxml,Gamma-secretase inhibitors reverse glucocorticoid resistance in T-ALL,nature medicine,RSG0806801 to I.A.,237,Gamma-secretase inhibitors reverse glucocorticoid resistance in T-ALL
articles.I-N,Int_J_Nanomedicine,Int_J_Nanomedicine_2014_Mar_26_9_1617-1626.nxml,Genetically engineered nanocarriers for drug delivery,international journal of nanomedicine,IRG-58-007-48,1,Genetically engineered nanocarriers for drug delivery
articles.I-N,Int_J_Nanomedicine,Int_J_Nanomedicine_2012_Feb_2_7_591-605.nxml,Impact of nanotechnology in cancer: emphasis on nanochemoprevention,international journal of nanomedicine,MRSG-11-019-01-CNE,29,Impact of nanotechnology in cancer: emphasis on nanochemoprevention
articles.I-N,Nat_Methods,Nat_Methods_2012_Mar_4_9(4)_379-384.nxml,TULIPs: Tunable  light-controlled interacting protein tags for cell biology,nature methods,PF-10-134-01-CCG,46,TULIPs: Tunable  light-controlled interacting protein tags for cell biology
articles.I-N,Nat_Methods,Nat_Methods_2012_Oct_9_9(10)_987-992.nxml,A general approach to break the concentration barrier in single-molecule imaging,nature methods,RSG0823401GMC,17,A general approach to break the concentration barrier in single-molecule imaging
articles.I-N,Mol_Cell,Mol_Cell_2009_Dec_11_36(5)_768-781.nxml,Rrp17p Is a Eukaryotic Exonuclease Required for 5 End Processing of Pre-60S Ribosomal RNA,molecular cell,RSG0404251,30,Rrp17p Is a Eukaryotic Exonuclease Required for 5 End Processing of Pre-60S Ribosomal RNA
articles.I-N,Nurs_Res_Pract,Nurs_Res_Pract_2011_May_5_2011_987924.nxml,Nonresponse Error in Mail Surveys: Top Ten Problems,nursing research and practice,RSG-08-148-01-CPPB,3,Nonresponse Error in Mail Surveys: Top Ten Problems
articles.I-N,J_Biomed_Biotechnol,J_Biomed_Biotechnol_2002_2(2)_75-85.nxml,Homologous Recombination and Its Role in Carcinogenesis,journal of biomedicine and biotechnology,RPG-95-076-04-MGO,39,Homologous recombination and its role in carcinogenesis
articles.I-N,J_Biomed_Biotechnol,J_Biomed_Biotechnol_2011_Oct_27_2011_124595.nxml,Herpesvirus BACs: Past  Present  and Future,journal of biomedicine and biotechnology,IRG-92-032-13,22,Herpesvirus BACs: past  present  and future
articles.I-N,Nat_Struct_Mol_Biol,Nat_Struct_Mol_Biol_2009_Jul_14_16(7)_731-739.nxml,Structural evidence for consecutive Hel308-like modules in the spliceosomal ATPase Brr2,nature structural & molecular biology,RSG-06-165-01-GMC,50,Structural evidence for consecutive Hel308-like modules in the spliceosomal ATPase Brr2
articles.I-N,Nat_Struct_Mol_Biol,Nat_Struct_Mol_Biol_2011_Jun_26_18(7)_761-768.nxml,Chfr and RNF8 synergistically regulate ATM activation,nature structural & molecular biology,RSG-08-125-01-CCG,29,Chfr and RNF8 synergistically regulate ATM activation
articles.I-N,Nat_Struct_Mol_Biol,Nat_Struct_Mol_Biol_2009_Jan_21_16(1)_42-48.nxml,ATP-dependent unwinding of U4/U6 snRNAs by the Brr2 helicase requires the C-terminus of Prp8,nature structural & molecular biology,PF-01-236-01-GMC,55,ATP-dependent unwinding of U4/U6 snRNAs by the Brr2 helicase requires the C-terminus of Prp8
articles.I-N,Nat_Struct_Mol_Biol,Nat_Struct_Mol_Biol_2012_Aug_29_19(8)_773-781.nxml,Mili and Miwi target RNA repertoire reveals piRNA biogenesis and function of Miwi in spermiogenesis,nature structural & molecular biology,IRG-78-002-30,35,Mili and Miwi target RNA repertoire reveals piRNA biogenesis and function of Miwi in spermiogenesis
articles.I-N,Nat_Struct_Mol_Biol,Nat_Struct_Mol_Biol_2013_Jul_16_20(7)_781-788.nxml,Conformational switching of the 26S proteasome enables substrate degradation,nature structural & molecular biology,PF-11-178-01-TBE,24,Conformational switching of the 26S proteasome enables substrate degradation
articles.I-N,Nat_Struct_Mol_Biol,Nat_Struct_Mol_Biol_2013_Dec_3_20(12)_10_1038_nsmb_2706.nxml,Multisite phosphorylation networks as signal processors for Cdk1,nature structural & molecular biology,RSG-12-131-01-CCG,4,Multisite phosphorylation networks as signal processors for Cdk1
articles.I-N,J_Exp_Med,J_Exp_Med_2002_May_6_195(9)_1145-1154.nxml,Hematopoietic Stem Cells Are Uniquely Selective in Their Migratory Response to Chemokines,the journal of experimental medicine,PF-00-017-01-LBC,443,Hematopoietic stem cells are uniquely selective in their migratory response to chemokines
articles.I-N,J_Exp_Med,J_Exp_Med_2010_May_10_207(5)_1045-1056.nxml,The NLRP3 inflammasome functions as a negative regulator of tumorigenesis during colitis-associated cancer NLRP3 suppresses colitis-associated cancer,the journal of experimental medicine,PF-10-053-01-LIB,203,The NLRP3 inflammasome functions as a negative regulator of tumorigenesis during colitis-associated cancer NLRP3 suppresses colitis-associated cancer
articles.I-N,J_Exp_Med,J_Exp_Med_2001_Nov_5_194(9)_1325-1338.nxml,Resistance to Granzyme B-mediated Cytochrome c Release in Bak-deficient Cells,the journal of experimental medicine,RPG-98-288-01-CIM,71,Resistance to granzyme B-mediated cytochrome c release in Bak-deficient cells
articles.I-N,J_Exp_Med,J_Exp_Med_2012_Sep_24_209(10)_1869-1882.nxml,Cancer immunoediting by the innate immune system in the absence of adaptive immunity Tumor editing by macrophages and NK cells,the journal of experimental medicine,ACS-IRG #70-002,42,Cancer immunoediting by the innate immune system in the absence of adaptive immunity Tumor editing by macrophages and NK cells
articles.I-N,J_Exp_Med,J_Exp_Med_2004_Jun_7_199(11)_1513-1522.nxml,Nuclear Factor of Activated T Cells Balances Angiogenesis Activation and Inhibition,the journal of experimental medicine,RSG-01-099-01-CSM,114,Nuclear factor of activated T cells balances angiogenesis activation and inhibition
articles.I-N,J_Exp_Med,J_Exp_Med_1999_Nov_1_190(9)_1257-1262.nxml,Irradiation-Mediated Rescue of T CellSpecific V(D)j Recombination and Thymocyte Differentiation in Severe Combined Immunodeficient Mice by Bone Marrow Cells,the journal of experimental medicine,RPG-95-027-04,3,Irradiation-mediated Rescue of T Cell–specific V (D) J Recombination and Thymocyte Differentiation in Severe Combined Immunodeficient Mice by Bone Marrow  …
