articles.I-N,J_Gen_Virol,J_Gen_Virol_2010_Nov_91(Pt_11)_2664-2676.nxml,Murine cytomegalovirus major immediate-early protein 3 interacts with cellular and viral proteins in viral DNA replication compartments and is important for early gene activation,the journal of general virology,IRG-92-032-13,11,Murine cytomegalovirus major immediate-early protein 3 interacts with cellular and viral proteins in viral DNA replication compartments and is important for early gene activation
articles.I-N,Nucl_Recept_Signal,Nucl_Recept_Signal_2005_Oct_21_3_e004.nxml,Chaperoning steroid hormone signaling via reversible acetylation Role of acetylation in NR signaling,nuclear receptor signaling,RSG-03-147-01-CSM,22,Chaperoning steroid hormone signaling via reversible acetylation Role of acetylation in NR signaling
articles.I-N,Int_J_Circumpolar_Health,Int_J_Circumpolar_Health_2013_Aug_5_72_10_3402_ijch_v72i0_20717.nxml,Bridging storytelling traditions with digital technology,international journal of circumpolar health,MRSGT-09-007-01-CPPB,1,Bridging storytelling traditions with digital technology
articles.I-N,Nat_Chem,Nat_Chem_2013_Feb_23_5(2)_126-131.nxml,A divergent approach to the synthesis of the yohimbinoid alkaloids venenatine and alstovenine,nature chemistry,RSG-09-017-01,4,A divergent approach to the synthesis of the yohimbinoid alkaloids venenatine and alstovenine
articles.I-N,Nat_Chem,Nat_Chem_2010_Aug_23_2(8)_638-643.nxml,Convergent and Stereospecific Synthesis of Complex Skipped Polyenes and Polyunsaturated Fatty Acids,nature chemistry,RSG-06-117-01,17,Convergent and Stereospecific Synthesis of Complex Skipped Polyenes and Polyunsaturated Fatty Acids
articles.I-N,J_Community_Health,J_Community_Health_2010_Apr_15_35(2)_156-164.nxml,Conducting Health Research in Korean American Churches: Perspectives from Church Leaders,journal of community health,MSRGT-07-168-01-CPPB,14,Conducting Health Research in Korean American Churches: Perspectives from Church Leaders
articles.I-N,Nucleus,Nucleus_2012_May_1_3(3)_226-236.nxml,Nuclear envelope insertion of spindle pole bodies and nuclear pore complexes,nucleus,RSG-11-030-01-CSM,11,Nuclear envelope insertion of spindle pole bodies and nuclear pore complexes
articles.I-N,Immunol_Cell_Biol,Immunol_Cell_Biol_2012_Jan_8_90(1)_101-108.nxml,Absence of scavenger receptor A promotes dendritic cell-mediated cross-presentation of cell-associated antigen and antitumor immune response,immunology and cell biology,RSG-08-187-01-LIB,11,Absence of scavenger receptor A promotes dendritic cell-mediated cross-presentation of cell-associated antigen and antitumor immune response
articles.I-N,J_Gen_Physiol,J_Gen_Physiol_2013_Aug_142(2)_157-169.nxml,Neurotoxic unc-8 mutants encode constitutively active DEG/ENaC channels that are blocked by divalent cations Divalent cation block of neurotoxic degenerin UNC-8(d),the journal of general physiology,RGS-09-043-01-DDC,1,Neurotoxic unc-8 mutants encode constitutively active DEG/ENaC channels that are blocked by divalent cations Divalent cation block of neurotoxic degenerin UNC-8(d)
articles.I-N,Nat_Cell_Biol,Nat_Cell_Biol_2011_Jun_19_13(7)_762-770.nxml,Opposing Effects of Tcf3 and Tcf1 Control Wnt-Stimulation of Embryonic Stem Cell Self Renewal,nature cell biology,RSG GGC 112994,103,Opposing Effects of Tcf3 and Tcf1 Control Wnt-Stimulation of Embryonic Stem Cell Self Renewal
articles.I-N,Nat_Cell_Biol,Nat_Cell_Biol_2013_Oct_22_15(10)_1206-1219.nxml,PI(3)P-bound UVRAG coordinates Golgi-ER retrograde and Atg9 transport by differential interactions with the ER tether and the Beclin1 complex,nature cell biology,RSG-11-121-01-CCG,3,PI(3)P-bound UVRAG coordinates Golgi-ER retrograde and Atg9 transport by differential interactions with the ER tether and the Beclin1 complex
articles.I-N,Nat_Cell_Biol,Nat_Cell_Biol_2008_Oct_21_10(10)_1208-1216.nxml,Jade-1 inhibits Wnt signaling by ubiquitinating -catenin and mediates Wnt pathway inhibition by pVHL,nature cell biology,IRG-72-001-32-IRG,76,Jade-1 inhibits Wnt signaling by ubiquitinating -catenin and mediates Wnt pathway inhibition by pVHL
articles.I-N,Nat_Cell_Biol,Nat_Cell_Biol_2013_May_21_15(5)_491-501.nxml,DAF-16/FOXO employs the chromatin remodeller SWI/SNF to promote stress resistance and longevity,nature cell biology,PF-12-078-01-RMC,13,DAF-16/FOXO employs the chromatin remodeller SWI/SNF to promote stress resistance and longevity
articles.I-N,Nat_Cell_Biol,Nat_Cell_Biol_2011_Oct_9_13(11)_1361-1367.nxml,Microtubules induce self-organization of polarized PAR domains in C. elegans zygotes,nature cell biology,PF-08-158-01,31,Microtubules induce self-organization of polarized PAR domains in C. elegans zygotes
articles.I-N,Nat_Cell_Biol,Nat_Cell_Biol_2010_Feb_17_12(2)_193-199.nxml,Regulation of NF-B inhibitor IB and viral replication by a KSHV microRNA,nature cell biology,#RSG-04-195,127,Regulation of NF-B inhibitor IB and viral replication by a KSHV microRNA
articles.I-N,Int_J_Oncol,Int_J_Oncol_2012_May_31_41(2)_721-732.nxml,Loss of post-transcriptional regulation of DNMT3b by microRNAs: A possible molecular mechanism for the hypermethylation defect observed in a subset of breast cancer cell lines,international journal of oncology,PF-08-166-01-GMC,7,Loss of post-transcriptional regulation of DNMT3b by microRNAs: A possible molecular mechanism for the hypermethylation defect observed in a subset of breast cancer cell lines
articles.I-N,Int_J_Oncol,Int_J_Oncol_2013_May_27_43(2)_548-560.nxml,The microRNA-200 family targets multiple non-small cell lung cancer prognostic markers in H1299 cells and BEAS-2B cells,international journal of oncology,IRG-09-061-04-IRG,11,The microRNA-200 family targets multiple non-small cell lung cancer prognostic markers in H1299 cells and BEAS-2B cells
articles.I-N,Int_J_Oncol,Int_J_Oncol_2013_Oct_11_43(6)_2031-2038.nxml,Autophagy sensitivity of neuroendocrine lung tumor cells,international journal of oncology,RSGM-10-189-01-TBE,0,Autophagy sensitivity of neuroendocrine lung tumor cells
articles.I-N,J_Transl_Med,J_Transl_Med_2007_Mar_13_5_14.nxml,Tumor-specific T cells signal tumor destruction via the lymphotoxin  receptor,journal of translational medicine,LIB-106810,5,Tumor-specific T cells signal tumor destruction via the lymphotoxin  receptor
articles.I-N,J_Transl_Med,J_Transl_Med_2009_Mar_26_7_24.nxml,Sigma-2 receptor ligands potentiate conventional chemotherapies and improve survival in models of pancreatic adenocarcinoma,journal of translational medicine,MRSG-08-019-01,34,Sigma-2 receptor ligands potentiate conventional chemotherapies and improve survival in models of pancreatic adenocarcinoma
articles.I-N,J_Transl_Med,J_Transl_Med_2008_Jul_24_6_41.nxml,Use of cancer-specific yeast-secreted in vivo biotinylated recombinant antibodies for serum biomarker discovery,journal of translational medicine,PF0523501,14,Use of cancer-specific yeast-secreted in vivo biotinylated recombinant antibodies for serum biomarker discovery
articles.I-N,Lab_Invest,Lab_Invest_2010_Oct_28_90(10)_1415-1424.nxml,ERBB4 PROMOTES CYCLOOXYGENASE-2 EXPRESSION AND CELL SURVIVAL IN COLON EPITHELIAL CELLS,laboratory investigation a journal of technical methods and pathology,IRG-58-009-50-MRF,11,ERBB4 PROMOTES CYCLOOXYGENASE-2 EXPRESSION AND CELL SURVIVAL IN COLON EPITHELIAL CELLS
articles.I-N,Lab_Invest,Lab_Invest_2010_May_8_90(5)_762-773.nxml,Hydrogen peroxide inhibits mTOR signaling by activation of AMPK leading to apoptosis of neuronal cells,laboratory investigation a journal of technical methods and pathology,RSG-08-135-01-CNE,69,Hydrogen peroxide inhibits mTOR signaling by activation of AMPK leading to apoptosis of neuronal cells
articles.I-N,Lab_Invest,Lab_Invest_2011_Jul_4_91(7)_1007-1017.nxml,Validation of Stereophotogrammetry of the Human Torso,laboratory investigation a journal of technical methods and pathology,RSC-118760,4,Validation of Stereophotogrammetry of the Human Torso
articles.I-N,Nat_Immunol,Nat_Immunol_2012_Mar_11_13(4)_405-411.nxml,Molecular mechanisms that control the expression and activity of Bcl-6 in T H 1 cells to regulate flexibility with a T FH -like gene profile,nature immunology,RSG-09-045-01-DDC,69,Molecular mechanisms that control the expression and activity of Bcl-6 in T H 1 cells to regulate flexibility with a T FH -like gene profile
articles.I-N,Nat_Immunol,Nat_Immunol_2010_Mar_17_11(3)_207-215.nxml,Hematopoietic Stem Cell Differentiation Regulated by a Single Ubiquitin Ligase: Substrate Complex,nature immunology,RSG-08-068-01,36,Hematopoietic Stem Cell Differentiation Regulated by a Single Ubiquitin Ligase: Substrate Complex
articles.I-N,J_Mammary_Gland_Biol_Neoplasia,J_Mammary_Gland_Biol_Neoplasia_2009_Jun_21_14(2)_87-98.nxml,Pregnancy and Breast Cancer: when They Collide,journal of mammary gland biology and neoplasia,PF-08-257-01-CSM,79,Pregnancy and Breast Cancer: when They Collide
articles.I-N,J_Mammary_Gland_Biol_Neoplasia,J_Mammary_Gland_Biol_Neoplasia_2010_Jun_19_15(2)_117-134.nxml,Epithelial-Mesenchymal Transition in Cancer: Parallels Between Normal Development and Tumor Progression,journal of mammary gland biology and neoplasia,RSG-07-183-01-DDC,318,Epithelial-Mesenchymal Transition in Cancer: Parallels Between Normal Development and Tumor Progression
articles.I-N,Nat_Chem_Biol,Nat_Chem_Biol_2013_Mar_6_9(3)_184-191.nxml,Discovery of a chemical probe for the L3MBTL3 methyl-lysine reader domain,nature chemical biology,PF-10-183-01-TBE,23,Discovery of a chemical probe for the L3MBTL3 methyl-lysine reader domain
articles.I-N,Nat_Chem_Biol,Nat_Chem_Biol_2009_Feb_4_5(2)_100-107.nxml,Small molecule-mediated disruption of Wnt-dependent signaling in tissue regeneration and cancer,nature chemical biology,RSGGMC-112251,422,Small molecule-mediated disruption of Wnt-dependent signaling in tissue regeneration and cancer
articles.I-N,Nat_Chem_Biol,Nat_Chem_Biol_2012_Mar_18_8(5)_437-446.nxml,LYP inhibits T cell activation when dissociated from CSK,nature chemical biology,RSG-08-067-01-LIB,38,LYP inhibits T cell activation when dissociated from CSK
articles.I-N,J_Gen_Intern_Med,J_Gen_Intern_Med_2007_Nov_24_22(Suppl_2)_300-305.nxml,Barriers Beyond Words: Cancer  Culture  and Translation in a Community of Russian Speakers,journal of general internal medicine,MRSGT-05-194-01-CPHPS,41,Barriers Beyond Words: Cancer  Culture  and Translation in a Community of Russian Speakers
articles.I-N,J_Gen_Intern_Med,J_Gen_Intern_Med_2007_Apr_30_22(4)_523-526.nxml,Factors Influencing Physicians Screening Behavior for Liver Cancer Among High-risk Patients,journal of general internal medicine,CCCDA-02-221-01,14,nih.gov [HTML] Factors influencing physicians' screening behavior for liver cancer among high-risk patients
articles.I-N,J_Gen_Intern_Med,J_Gen_Intern_Med_2007_Mar_9_22(3)_332-337.nxml,Specificity of Clinical Breast Examination in Community Practice,journal of general internal medicine,MRSGT-05-214-01-CPPB,17,Specificity of Clinical Breast Examination in Community Practice
articles.I-N,J_Oncol,J_Oncol_2009_Oct_25_2009_871250.nxml,Conducting Molecular Epidemiological Research in the Age of HIPAA: A Multi-Institutional Case-Control Study of Breast Cancer in African-American and European-American Women,journal of oncology,RSGT-07-291-01-CPHPS,28,Conducting Molecular Epidemiological Research in the Age of HIPAA: A Multi-Institutional Case-Control Study of Breast Cancer in African-American and European-American Women
articles.I-N,J_Oncol,J_Oncol_2011_Dec_13_2011_365651.nxml, 2 Integrin-Dependent Suppression of Pancreatic Adenocarcinoma Cell Invasion Involves Ectodomain Regulation of Kallikrein-Related Peptidase-5,journal of oncology,RSG-05-116-01-CSM,6,α 2 Integrin-Dependent Suppression of Pancreatic Adenocarcinoma Cell Invasion Involves Ectodomain Regulation of Kallikrein-Related Peptidase-5
articles.I-N,J_Oncol,J_Oncol_2010_Mar_15_2010_397632.nxml,Is There a Predisposition Gene for Ewing's Sarcoma?,journal of oncology,RSG0618801MGO,26,Is There a Predisposition Gene for Ewing's Sarcoma?
articles.I-N,Int_J_Behav_Nutr_Phys_Act,Int_J_Behav_Nutr_Phys_Act_2007_Sep_13_4_35.nxml,Distance to food stores & adolescent male fruit and vegetable consumption: mediation effects,the international journal of behavioral nutrition and physical activity,ACS TURSG-01,83,Distance to food stores & adolescent male fruit and vegetable consumption: mediation effects
articles.I-N,J_Ocul_Biol_Dis_Infor,J_Ocul_Biol_Dis_Infor_2009_Dec_12_2(4)_214-222.nxml,The role of DNA microarrays in Toxoplasma gondii research  the causative agent of ocular toxoplasmosis,journal of ocular biology diseases and informatics,MBC-114461,4,The role of DNA microarrays in Toxoplasma gondii research  the causative agent of ocular toxoplasmosis
articles.I-N,Leuk_Res_Rep,Leuk_Res_Rep_2014_Apr_18_3(1)_28-31.nxml,Fludarabine and cyclophosphamide provides a nonmyeloablative alternative conditioning regimen with low transplant-related mortality and control of high risk disease,leukemia research reports,GSCNP-10-218-01-SCN,0,Fludarabine and cyclophosphamide provides a nonmyeloablative alternative conditioning regimen with low transplant-related mortality and control of high risk disease
articles.I-N,J_Gerontol_Geriatr_Res,J_Gerontol_Geriatr_Res_2013_Dec_1_2(4)_134.nxml,Age-Related Treatment Disparities among Medicaid Beneficiaries with Metastatic Colorectal Cancer,journal of gerontology & geriatric research,RSGT-07-011-01-CPHPS,0,Age-Related Treatment Disparities among Medicaid Beneficiaries with Metastatic Colorectal Cancer
articles.I-N,J_Cancer_Surviv,J_Cancer_Surviv_2010_Mar_6_4(1)_45-58.nxml,Measuring the impact of cancer: a comparison of non-Hodgkin lymphoma and breast cancer survivors,journal of cancer survivorship,DSW-0321301-SW,24,Measuring the impact of cancer: a comparison of non-Hodgkin lymphoma and breast cancer survivors
articles.I-N,J_Cancer_Surviv,J_Cancer_Surviv_2009_Sep_13_3(3)_137-147.nxml,Cancer survivorship research: the challenge of recruiting adult long term cancer survivors from a cooperative clinical trials group,journal of cancer survivorship,RSGPB-05-236-01-CPPB,21,Cancer survivorship research: the challenge of recruiting adult long term cancer survivors from a cooperative clinical trials group
articles.I-N,Mamm_Genome,Mamm_Genome_2007_Jan_22_18(1)_75-85.nxml,Mapping and identification of candidate loci responsible for Peromyscus hybrid overgrowth,mammalian genome,RSG-03-070-01-MGO,22,Mapping and identification of candidate loci responsible for Peromyscus hybrid overgrowth
articles.I-N,Int_J_Biol_Sci,Int_J_Biol_Sci_2005_Apr_1_1(2)_44-50.nxml,PIKE GTPase Signaling and Function,international journal of biological sciences,RSG-04-077-01-TBE,18,PIKE GTPase Signaling and Function
articles.I-N,Int_J_Biol_Sci,Int_J_Biol_Sci_2010_Oct_7_6(6)_599-612.nxml,Aberrant Cytoplasm Localization and Protein Stability of SIRT1 is Regulated by PI3K/IGF-1R Signaling in Human Cancer Cells,international journal of biological sciences,IRG-72-001-27-IRG,41,Aberrant Cytoplasm Localization and Protein Stability of SIRT1 is Regulated by PI3K/IGF-1R Signaling in Human Cancer Cells
articles.I-N,Langmuir,Langmuir_2008_Aug_5_24(15)_8169-8173.nxml,Paramagnetic Porous Polymersomes Paramagnetic Porous Polymersomes,langmuir,RSG-07-005-01,52,Paramagnetic Porous Polymersomes Paramagnetic Porous Polymersomes
articles.I-N,J_Biomed_Opt,J_Biomed_Opt_2013_Feb_12_18(2)_026018.nxml,Photoacoustic contrast imaging of biological tissues with nanodiamonds fabricated for high near-infrared absorbance,journal of biomedical optics,RSG-0813301CDD,4,Photoacoustic contrast imaging of biological tissues with nanodiamonds fabricated for high near-infrared absorbance
articles.I-N,J_Biomed_Opt,J_Biomed_Opt_2013_Feb_5_18(2)_026009.nxml,Comparison of photoacoustic image reconstruction algorithms using the channelized Hotelling observer,journal of biomedical optics,RSG-08-117-01-CCE,3,Comparison of photoacoustic image reconstruction algorithms using the channelized Hotelling observer
articles.I-N,J_Cell_Biol,J_Cell_Biol_2010_Aug_9_190(3)_443-460.nxml,KIF17 stabilizes microtubules and contributes to epithelial morphogenesis by acting at MT plus ends with EB1 and APC KIF17 contributes to microtubule stabilization and epithelial polarization,the journal of cell biology,RSG-06-142-01-CSM,46,KIF17 stabilizes microtubules and contributes to epithelial morphogenesis by acting at MT plus ends with EB1 and APC KIF17 contributes to microtubule stabilization and epithelial polarization
articles.I-N,J_Cell_Biol,J_Cell_Biol_1999_Feb_22_144(4)_701-710.nxml,Altered Cytochrome c Display Precedes Apoptotic Cell Death in Drosophila,the journal of cell biology,CB-80362,126,Altered Cytochrome c Display Precedes Apoptotic Cell Death in Drosophila
articles.I-N,J_Cell_Biol,J_Cell_Biol_1997_Aug_25_138(4)_783-797.nxml,Actin Filament Cables in Drosophila Nurse Cells Are Composed of Modules That Slide Passively Past One Another during Dumping,the journal of cell biology,DB-89A,77,Actin Filament Cables in Drosophila Nurse Cells Are Composed of Modules That Slide Passively Past One Another during Dumping
articles.I-N,J_Cell_Biol,J_Cell_Biol_2005_Jan_17_168(2)_245-255.nxml,Actin-myosinbased contraction is responsible for apoptotic nuclear disintegration,the journal of cell biology,RGS-04-078-01-TBE,108,Actin-myosin–based contraction is responsible for apoptotic nuclear disintegration
articles.I-N,J_Cell_Biol,J_Cell_Biol_2006_Mar_13_172(6)_875-884.nxml,The Drosophila melanogaster Cajal body,the journal of cell biology,PF-04-022-01-CSM,111,The Drosophila melanogaster Cajal body
articles.I-N,J_Cell_Biol,J_Cell_Biol_2003_Sep_29_162(7)_1317-1328.nxml,Uncovering multiple axonal targeting pathways in hippocampal neurons,the journal of cell biology,PF-01-092-01-CSM,112,Uncovering multiple axonal targeting pathways in hippocampal neurons
articles.I-N,J_Cell_Biol,J_Cell_Biol_2013_Mar_18_200(6)_721-729.nxml,Misshapen decreases integrin levels to promote epithelial motility and planar polarity in Drosophila  Msn promotes epithelial motility and planar polarity,the journal of cell biology,PF-12-135-01-CSM,2,Misshapen decreases integrin levels to promote epithelial motility and planar polarity in Drosophila  Msn promotes epithelial motility and planar polarity
articles.I-N,J_Cell_Biol,J_Cell_Biol_1998_Oct_19_143(2)_359-373.nxml,Mitochondrial Fusion in Yeast Requires the Transmembrane GTPase Fzo1p,the journal of cell biology,CB-97,399,Mitochondrial Fusion in Yeast Requires the Transmembrane GTPase Fzo1p
articles.I-N,J_Cell_Biol,J_Cell_Biol_2005_Nov_7_171(3)_437-445.nxml,Centrobin a novel daughter centrioleassociated protein that is required for centriole duplication,the journal of cell biology,RSG-03-048-01,68,Centrobin a novel daughter centriole–associated protein that is required for centriole duplication
articles.I-N,J_Cell_Biol,J_Cell_Biol_2006_Apr_24_173(2)_173-179.nxml,Kinesin 5independent poleward flux of kinetochore microtubules in PtK1 cells,the journal of cell biology,PF-02-095-01-CCG,68,Kinesin 5–independent poleward flux of kinetochore microtubules in PtK1 cells
articles.I-N,J_Cell_Biol,J_Cell_Biol_2000_Mar_6_148(5)_863-870.nxml,In Situ Biochemical Demonstration That P-Glycoprotein Is a Drug Efflux Pump with Broad Specificity,the journal of cell biology,RPG-98-177-01-CDD,57,In Situ Biochemical Demonstration That P-Glycoprotein Is a Drug Efflux Pump with Broad Specificity
articles.I-N,J_Cell_Biol,J_Cell_Biol_1998_May_4_141(3)_663-674.nxml,The Mammalian -Tubulin Complex Contains Homologues of the Yeast Spindle Pole Body Components Spc97p and Spc98p,the journal of cell biology,PF-4198,179,The Mammalian -Tubulin Complex Contains Homologues of the Yeast Spindle Pole Body Components Spc97p and Spc98p
articles.I-N,J_Cell_Biol,J_Cell_Biol_1998_Jun_15_141(6)_1357-1370.nxml,The Src Homology Domain 3 (SH3) of a Yeast Type I Myosin  Myo5p  Binds to Verprolin and Is Required for Targeting to Sites of Actin Polarization,the journal of cell biology,RPG-97-163-01,110,The Src Homology Domain 3 (SH3) of a Yeast Type I Myosin  Myo5p  Binds to Verprolin and Is Required for Targeting to Sites of Actin Polarization
articles.I-N,J_Cell_Biol,J_Cell_Biol_1998_Dec_28_143(7)_1789-1800.nxml,Saccharomyces cerevisiae Ndc1p Is a Shared Component of Nuclear Pore Complexes and Spindle Pole Bodies,the journal of cell biology,RPG-96-101-03-CSM,118,Saccharomyces cerevisiae Ndc1p Is a Shared Component of Nuclear Pore Complexes and Spindle Pole Bodies
articles.I-N,J_Cell_Biol,J_Cell_Biol_1999_Nov_15_147(4)_729-742.nxml,Sec34p  a Protein Required for Vesicle Tethering to the Yeast Golgi Apparatus  Is in a Complex with Sec35p,the journal of cell biology,RPG-98-050-01-CSM,109,Sec34p  a Protein Required for Vesicle Tethering to the Yeast Golgi Apparatus  Is in a Complex with Sec35p
articles.I-N,J_Cell_Biol,J_Cell_Biol_2008_Apr_21_181(2)_241-254.nxml,Aurora B kinase and protein phosphatase 1 have opposing roles in modulating kinetochore assembly,the journal of cell biology,RSG-04-021-01-CCG,79,Aurora B kinase and protein phosphatase 1 have opposing roles in modulating kinetochore assembly
articles.I-N,J_Cell_Biol,J_Cell_Biol_1997_Sep_8_138(5)_1055-1066.nxml,Mitotic Spindle Poles are Organized by Structural and Motor Proteins in Addition to Centrosomes,the journal of cell biology,JFRA-635,184,Mitotic Spindle Poles are Organized by Structural and Motor Proteins in Addition to Centrosomes
articles.I-N,J_Cell_Biol,J_Cell_Biol_1997_Apr_7_137(1)_141-153.nxml,The Yeast Gene  MDM20  Is Necessary for Mitochondrial Inheritance and Organization of the Actin Cytoskeleton,the journal of cell biology,CB-97,127,The Yeast Gene  MDM20  Is Necessary for Mitochondrial Inheritance and Organization of the Actin Cytoskeleton
articles.I-N,J_Cell_Biol,J_Cell_Biol_2013_May_27_201(5)_741-757.nxml,Diet controls Drosophila follicle stem cell proliferation via Hedgehog sequestration and release Cholesterol controls FSC proliferation,the journal of cell biology,PF-11-068-01-TBE,3,Diet controls Drosophila follicle stem cell proliferation via Hedgehog sequestration and release Cholesterol controls FSC proliferation
articles.I-N,J_Cell_Biol,J_Cell_Biol_2001_Aug_6_154(3)_645-658.nxml,High resolution mapping of mast cell membranes reveals primary and secondary domains of FcRI and LAT,the journal of cell biology,RPG-99-233-01-CIM,163,High resolution mapping of mast cell membranes reveals primary and secondary domains of Fc RI and LAT
articles.I-N,J_Cell_Biol,J_Cell_Biol_1997_Jun_2_137(5)_1117-1125.nxml,Temporal Phases in Apoptosis Defined by the Actions of Src Homology 2 Domains  Ceramide  Bcl-2  Interleukin-1 Converting Enzyme Family Proteases  and a Dense Membrane Fraction,the journal of cell biology,DB-97,43,Temporal Phases in Apoptosis Defined by the Actions of Src Homology 2 Domains  Ceramide  Bcl-2  Interleukin-1 Converting Enzyme Family Proteases  and a Dense Membrane Fraction
articles.I-N,J_Cell_Biol,J_Cell_Biol_2007_Sep_24_178(7)_1109-1120.nxml,APC mutations lead to cytokinetic failures in vitro and tetraploid genotypes in Min mice,the journal of cell biology,RSG-02-035-05-CCG,96,APC mutations lead to cytokinetic failures in vitro and tetraploid genotypes in Min mice
articles.I-N,J_Cell_Biol,J_Cell_Biol_1997_Apr_21_137(2)_399-416.nxml,High Rates of Actin Filament Turnover in Budding Yeast and Roles for Actin in Establishment and Maintenance of Cell Polarity Revealed Using the Actin Inhibitor Latrunculin-A,the journal of cell biology,CB-106  FRA-442,630,High Rates of Actin Filament Turnover in Budding Yeast and Roles for Actin in Establishment and Maintenance of Cell Polarity Revealed Using the Actin Inhibitor Latrunculin-A
articles.I-N,J_Cell_Biol,J_Cell_Biol_2011_Oct_17_195(2)_231-243.nxml,The Protein Phosphatase 2A regulatory subunit Twins stabilizes Plk4 to induce centriole amplification PP2A stabilizes Plk4 to induce centriole amplification,the journal of cell biology,IRG 74-001-31,27,The Protein Phosphatase 2A regulatory subunit Twins stabilizes Plk4 to induce centriole amplification PP2A stabilizes Plk4 to induce centriole amplification
articles.I-N,J_Cell_Biol,J_Cell_Biol_2003_Mar_3_160(5)_753-767.nxml,Differential regulation of cell motility and invasion by FAK,the journal of cell biology,RPG-98-109-TBE,435,Differential regulation of cell motility and invasion by FAK
articles.I-N,J_Cell_Biol,J_Cell_Biol_2003_Feb_17_160(4)_505-516.nxml,Targeting of U4/U6 small nuclear RNP assembly factor SART3/p110 to Cajal bodies,the journal of cell biology,RPG-00-110-01-MGO,87,Targeting of U4/U6 small nuclear RNP assembly factor SART3/p110 to Cajal bodies
articles.I-N,J_Cell_Biol,J_Cell_Biol_1999_Jul_12_146(1)_71-84.nxml,Gbf1 A Novel Golgi-Associated Bfa-Resistant Guanine Nucleotide Exchange Factor That Displays Specificity for Adp-Ribosylation Factor 5,the journal of cell biology,CB-96,156,Gbf1 A Novel Golgi-Associated Bfa-Resistant Guanine Nucleotide Exchange Factor That Displays Specificity for Adp-Ribosylation Factor 5
articles.I-N,J_Cell_Biol,J_Cell_Biol_2010_Jan_25_188(2)_237-251.nxml,GRASP55 and GRASP65 play complementary and essential roles in Golgi cisternal stacking GRASP55 and GRASP65 stack Golgi membranes together,the journal of cell biology,RGS-09-278-01-CSM,60,GRASP55 and GRASP65 play complementary and essential roles in Golgi cisternal stacking GRASP55 and GRASP65 stack Golgi membranes together
articles.I-N,J_Cell_Biol,J_Cell_Biol_2008_Oct_20_183(2)_267-277.nxml,The HECT E3 ligase Smurf2 is required for Mad2-dependent spindle assembly checkpoint,the journal of cell biology,RSG-03-048-01,24,The HECT E3 ligase Smurf2 is required for Mad2-dependent spindle assembly checkpoint
